Link,Huurprijs,Locatie,m2,Huurovereekomst,Beschrijving
https://www.pararius.com/room-for-rent/enschede/ef7e3f81/pathmossingel,€735 per month,7513 CM (Horstlanden-Stadsweide),30 m²,€735 per month,"Description For rent from 8 November For rent from 8 November Large furnished student room on the Pathmossingel, a few minutes by bike from the centre of Enschede. This cosy student house has 7 student rooms on the first and second floor, 2 shared bathrooms with toilet, spacious kitchen and a balcony. There is also a bicycle shed on the ground floor.                  "
https://www.pararius.com/apartment-for-rent/groningen/0c20a359/almastraat,"€1,142 per month",9716 CX (De Hoogte),66 m²,"€1,142 per month",Description Beautiful apartment for rent in Groningen with 1 bedroom in the De Hoogte district.
https://www.pararius.com/house-for-rent/almere/814e0a8f/cezannestraat,"€2,100 per month",1328 PC (Tussen de Vaarten Z.- Zuidwest),95 m²,"€2,100 per month","Description RENOVATED apartment on the top two floors in Almere! Available from December 1st
Maximum rental period: 24 months
Rent: €2100 per month (excluding)
Advance utilities: €250 per month
Furnished
Deposit: 2 months rent
Optionally furnished
Including private parking space              "
https://www.pararius.com/room-for-rent/eindhoven/160b4f03/zeelsterstraat,€300 per month,5652 EL (Het Ven),12 m²,€300 per month,"Description Neat spacious furnished room in large upstairs apartment with a total of 9 rooms. 2 bathrooms and 3 toilets which are shared with the other residents. 1 large kitchen which is shared. The room is in a convenient location, close to the center, shops and highways.
each week there is a cleaning in the house off the comon spaces.  the totall rentalprice inclusive gas, water, electricity, servicecosts, internet and citytax is €525,- per month"
https://www.pararius.com/apartment-for-rent/amsterdam/5f311223/ladogameerhof,"€2,300 per month",1060 PJ (De Aker),85 m²,"€2,300 per month","Description *GUANRANTEE NOT POSSIBLE In "" Osdorp De Aker"" in the upcoming Amsterdam Nieuw-West you will find this nice 4-room apartment of 85 m2 on the first floor.
The apartment is located within walking distance of various amenities such as shopping center ""De Dukaat"" with various supermarkets and specialty shops.
There are also cozy restaurants and sports facilities in the area.
Public transport can be reached just in front of the door, where tram 1 stops. Moreover, the roads are easily accessible just a few minutes away.                   "
https://www.pararius.com/apartment-for-rent/limbricht/b21cade3/pastoor-janssenstraat,"€1,120 per month",6141 AM (Limbricht),102 m²,"€1,120 per month","Description geWOON Makelaardij offers this fully furnished apartment in the heart of Limbricht. The house has three bedrooms and is very centrally located in relation to the connecting roads. Layout
The outbuilding for storage of bicycles (approx. 2m x 2m) is located around the corner. The apartment is located on the second floor where one through the entrance hall, with meter cupboard and toilet, has access to the spacious living room (approx. 44 m2) with tiled floor. From the living room is the open kitchen of 15.5 m2 accessible which is equipped with fridge, microwave, oven and extractor. The balcony (approx. 2 x 3 m) on South / West is accessible at the front. Through the landing there is access to the fully tiled bathroom with shower, toilet and sink, master bedroom of 11 m2, master bedroom of 13.5 m2 with 3-door wardrobe, third bedroom of 7.2 m2 and utility room with white goods connection. The house has a storage attic with storage shelves.              "
https://www.pararius.com/apartment-for-rent/amsterdam/fb0bb5eb/minervaplein,"€3,500 per month",1077 TK (Apollobuurt),120 m²,"€3,500 per month","Description Spacious and bright apartment (109 m2) with corner location and unobstructed view over Minervaplein, a central location in Amsterdam Oud-zuid.
The apartment is located on the third floor of a building with an elevator and is offered furnished.  LAYOUT
Communal entrance with access to the apartment on the third floor via the stairs or elevator.                           "
https://www.pararius.com/apartment-for-rent/amstelveen/4bbe0b88/dignahoeve,"€2,400 per month",1187 LX (Landschappenbuurt),95 m²,"€2,400 per month","Description On a perfect location in neighbourhood Westwijk in Amstelveen is a fully-furnished apartment for rent. The living/dining room is light and there is a semi-open kitchen.
The kitchen has all modern built-in appliances such as gascooking, oven, dishwasher and a fridge/freezer.     "
https://www.pararius.com/apartment-for-rent/utrecht/bd0941c6/oudegracht,"€2,150 per month",3511 AV (Breedstraat en Plompetorengracht en omgeving),45 m²,"€2,150 per month","Description Beautiful apartment for rent on the Oudegracht, in the heart of Utrecht! The apartment: Located on the ground floor
Features a very spacious living room and a bedroom (mezzanine)
Has a large open kitchen, equipped with a fridge/freezer combo, induction hob, extractor hood, combination microwave, and dishwasher Located on the ground floor Features a very spacious living room and a bedroom (mezzanine) Has a large open kitchen, equipped with a fridge/freezer combo, induction hob, extractor hood, combination microwave, and dishwasher               "
https://www.pararius.com/house-for-rent/heemstede/6fe315ef/reigerlaan,"€3,950 per month",2106 DE (Dichters- en Vogelbuurt),181 m²,"€3,950 per month","Description Reigerlaan 3, Heemstede A fantastic semi-detached villa in the ""Vogelpark"" neighbourhood, a popular and child-friendly area in Heemstede close to Aerdenhout. The house has five spacious bedrooms, open kitchen, large storage room and a bathroom. In addition, this house boasts a lovely garden on the waterfront and parking for two cars on site. The perfect house for those who want spacious living in an A-location.                                 "
https://www.pararius.com/house-for-rent/deurne/6d66cd68/trimpertstraat,€215 per month,5752 AN (Walsberg),50 m²,€215 per month,Description Nice house with garden for rent in Deurne with 1 bedroom in the Walsberg district.
https://www.pararius.com/apartment-for-rent/amsterdam/fddf6a7d/postjeskade,"€2,475 per month",1058 DH (Westindische Buurt),70 m²,"€2,475 per month","Description This beautifully renovated and luxuriously finished 3-room apartment of approximately 70 m², located by the water in the popular neighborhood of De Baarsjes, is a unique opportunity for those looking for modern comfort in a vibrant and green environment. The apartment offers bright, open spaces with a stunning view of the canal at the front and a quiet, green courtyard at the back. The high-quality finishes, modern kitchen with built-in appliances, and luxurious bathroom make this apartment an oasis of comfort in the city. Add to that the south-facing balcony, perfect for summer evenings, and the option to moor a boat right in front of your door, and you have a home that offers everything for luxurious and relaxed living in Amsterdam.                    "
https://www.pararius.com/apartment-for-rent/amsterdam/39a9cf16/van-noordtkade,"€3,150 per month",1013 BZ (Spaarndammerbuurt/Zeeheldenbuurt),114 m²,"€3,150 per month","Description BEAUTIFUL AND LUXURIOUS FINISHED 2 BEDROOM APARTMENT OF 114 M2 LOCATED ON THE TOP FLOOR, WITH A FANTASTIC TERRACE OF AT LEAST 95 M2 FACING SOUTHWEST AND A PARKING SPOT IN THE BASEMENT. The UNFURNISHED apartment is located on the Van Noordtkade canal on an island between the Houtmankade, Le Mairegracht and the Van Noordtgracht. A wonderful quiet location, yet only 500 meters from the Center. The Haarlemmerdijk, the Jordaan with its cozy shops and trendy restaurants, but also the green Westerpark are within walking distance. The Central Station is about 1500 meters away. Public transport nearby and within 5 minutes you are at the Ring A10 West. This well maintained apartment building (2007) is equipped with an elevator and a garage underneath.                                    "
https://www.pararius.com/room-for-rent/rotterdam/99be06fa/rodenrijselaan,€595 per month,3037 XE (Liskwartier),20 m²,€595 per month,Description ROTTERDAM-NOORD: Neat studio on the top floor with private facilities in a central location. The studio is available directly. PLEASE NOTE: The apartment is ONLY available for 1 STUDENT who is not from the municipality of Rotterdam and whose duration of study lasts approx. 2 years! PLEASE NOTE: The apartment is ONLY available for 1 STUDENT who is not from the municipality of Rotterdam and whose duration of study lasts approx. 2 years! Interested? Please respond by the contact buttons next to the description or e-mail ****** Interested? Please respond by the contact buttons next to the description or e-mail ******                                
https://www.pararius.com/room-for-rent/rotterdam/bad58e01/kortekade,€495 per month,3062 GL (Kralingen Oost),17 m²,€495 per month,Description ROTTERDAM KRALINGEN: Fully furnished studio on the third floor. The property is available directly. PLEASE NOTE: The apartment is ONLY available for 1 STUDENT who isnot from the municipality of Rotterdam and whose duration of study lasts approx. 2 years! PLEASE NOTE: The apartment is ONLY available for 1 STUDENT who isnot from the municipality of Rotterdam and whose duration of study lasts approx. 2 years! Interested? Respond via the contact buttons next to the description or send us an email Interested? Respond via the contact buttons next to the description or send us an email                                 
https://www.pararius.com/room-for-rent/haarlem/9ed78bad/duvenvoordestraat,€865 per month,2013 AA (Garenkokerskwartier),20 m²,€865 per month,"Description RENTED! RENTED! FOR RENT a stone's throw from the historic center of Haarlem this COZY STUDIO APARTMENT. For a neat and quiet person. Maximum one person!
This furnished studio is located on the second floor of a small-scale and well-maintained complex. living room and bedroom in one. OPEN KITCHEN. This is a furnished apartment. The washing machine is located one floor down and is used by several people.
THE TOILET IS SHARED WITH ONE PERSON!
The studio is located in a TOP LOCATION; within walking distance of the vibrant city center. NEAR THE STATION, sea, beach and dunes, sports facilities are nearby, bus connections are around the corner, you can easily reach the NS station by bike and HIGHWAYS are quickly and easily accessible. In short; a very nice studio in an ideal location.            "
https://www.pararius.com/apartment-for-rent/wageningen/d9febb53/generaal-foulkesweg,"€1,600 per month",6703 DE (Hamelakkers),120 m²,"€1,600 per month",Description Apartment with balcony for rent in Wageningen with 2 bedrooms in the Hamelakkers district.
https://www.pararius.com/room-for-rent/rotterdam/fb99642a/middellandplein,€464 per month,3021 BV (Middelland),20 m²,€464 per month,"Description ROTTERDAM MIDDELLAND: Spacious room with shared kitchen and bathroom, available immediately for 2 years! PLEASE NOTE: The apartment is only available for 1 STUDENT who is not from the municipality of Rotterdam and whose duration of study lasts approx. 1 year! PLEASE NOTE: The apartment is only available for 1 STUDENT who is not from the municipality of Rotterdam and whose duration of study lasts approx. 1 year! Interested? Please respond by the contact buttons next to this description or send us an e-mail Interested? Please respond by the contact buttons next to this description or send us an e-mail                              "
https://www.pararius.com/apartment-for-rent/nieuwegein/003e5e74/krijtwal,"€1,253 per month",3432 ZT (Merwestein),50 m²,"€1,253 per month","Description Modern and high-quality living with the modernized, lively center of Nieuwegein within walking distance? That's possible on the Krijtwal! In the former office building on the Krijtwal one 2-room apartment of approximately 50 m2 with large garden and private parking place will become available. Because of the large windows, this ready-to-move-in home has a lot of natural light, is equipped with a beautiful PVC laminate floor, new kitchen, bathroom and separate laundry room and toilet with fountain.                   "
https://www.pararius.com/apartment-for-rent/rotterdam/36574cbd/van-weelstraat,"€2,950 per month",3022 ZE (Nieuwe Westen),100 m²,"€2,950 per month","Description Modern furnished double ground floor house with 2 spacious bedrooms, a luxurious bathroom and a garden in the popular Delfshaven.
The location of this house is excellent! The house is located in a quiet and cozy street with lots of greenery and close to the city.
Located around the corner from the beautiful, green park of the Heemraadssingel and 5 minutes by bike from the always bustling center of Rotterdam. Public transport, highways (A13, A20) and amenities such as shops, (sports) schools and swimming pools are within easy reach and the monumental entrance of Diergaarde Blijdorp is a stone's throw away.               "
https://www.pararius.com/house-for-rent/bergen-nh/8716cb3d/herenweg,"€2,100 per month",1861 PC (Buitengebied Bergen),115 m²,"€2,100 per month","Description This romantic country house with garage is located in an excellent location just in the rural outskirts of Bergen NH. Above the garage is a large storage space that can possibly be used as a guest room.
Bergen aan Zee is within cycling distance, and the dunes start on the other side of the road.  Layout:
Ground floor:
Entrance hall, cellar cupboard, meter cupboard, access to bathroom with bath/shower, wall-mounted toilet and double sink combination. Spacious living room, approximately 44 m2 with attached conservatory, semi-open kitchen, with hob, extractor hood, combi-oven/microwave, dishwasher, refrigerator and freezer.             "
https://www.pararius.com/house-for-rent/lelystad/7eca9565/jol-13,"€2,250 per month",8243 EH (Bedrijventerrein Jol),125 m²,"€2,250 per month",Description Conveniently located house with garden for rent in Lelystad with 2 bedrooms in the Bedrijventerrein Jol district.
https://www.pararius.com/apartment-for-rent/schiedam/8e6c30db/broersvest,€820 per month,3112 DE (Natuurkundigenbuurt),65 m²,€820 per month,"Description This bare 3-room apartment is located in the center of Schiedam on the first floor with a balcony at the rear. The apartment is within walking distance of the shopping center, various shops and restaurants. The apartment is easily accessible by tram. Layout: The apartment has its own entrance and stairs to the first floor. The stairs lead to a hall that gives access to the living room, the kitchen, the bedroom and the toilet. The apartment has a spacious living room with a built-in closet. The living room is located at the front of the apartment and also gives access to the office space, which can be divided freely. This space also has a built-in closet. The brand new, modern, white colored kitchen has a sink, extractor hood, fridge and freezer. The kitchen gives access to the balcony which is located at the rear. The balcony can also be reached from the bedroom. The bedroom gives access to the bathroom. The bathroom has a sink with cabinet furniture and a shower. It is allowed to apply any change."
https://www.pararius.com/apartment-for-rent/amsterdam/fced917a/chassestraat,"€2,950 per month",1057 HV (Chassébuurt),72 m²,"€2,950 per month","Description AVAILABLE FROM 18-11-2024 FOR 4 MONTHS Fanastic renovated and spacious furnished apartment for rent for 4 months starting 18-11-2024. This apartment is located in a central part of Amsterdam and is close to all the facilities, public transport, A-10, and many bars, restaurants and supermarkets at walking distance. Perfect for an single expat who is just arriving to the city, or for a couple who need temporary accomodation.                 "
https://www.pararius.com/apartment-for-rent/amsterdam/5a66c623/de-clercqstraat,"€3,000 per month",1053 AG (Bellamybuurt),73 m²,"€3,000 per month","Description Use the button “Request a viewing” or “Contact the estate agent” on this page! EXCL. G/W/E/TV/Wifi. Deposit 2 months. Pets are not allowed. Very bright and luxurious furnished 2 bedroom apartment of 73m2 in the popular Old West with a terrace of 8m2 and a roof terrace of 43m2 with beautiful views, lighting, wooden floors and air conditioning. The entire property has been recently renovated. High-quality materials give a luxurious look to the apartment. The house is also equipped with very good insulation.                     "
https://www.pararius.com/apartment-for-rent/leiderdorp/3004b78d/hoofdstraat,€600 per month,2351 AK (Kerkwijk),26 m²,€600 per month,"Description Cozy One-Bedroom Apartment for Rent on Hoofdstraat in Leiderdorp, Available from April 1st Cozy One-Bedroom Apartment for Rent on Hoofdstraat in Leiderdorp, Available from April 1st This charming one-bedroom apartment, located on Hoofdstraat in Leiderdorp, is available for a new tenant starting April 1st! The apartment features a private living room with an open kitchen, a separate bedroom, and a spacious bathroom. The kitchen is equipped with a stove, an extractor fan, and a built-in refrigerator. Additionally, there is a shared washing machine available in the building for residents.   "
https://www.pararius.com/room-for-rent/leiden/a7dbde09/gerecht,€860 per month,2311 TC (Pieterswijk),22 m²,€860 per month,"Description Gerecht, Leiden (ca.22m2) € 860,- excl advance payment G/W/E.
We are looking for someone who is at least 21 years old, a PhD, master and/or student, suitable for 1 person.  This characteristic building in Leiden, consisting of 4 floors with 18 units, offers everything you need for a comfortable and cozy city life. This studio offers the ultimate in comfort with a private bathroom and kitchenette. It is fully furnished, including a desk where you can enjoy a beautiful view. Besides your own facilities, you can also enjoy the interaction and coziness of the common areas, including a very large and luxurious kitchen, laundry room and separate toilet. There is a communal garden in this property, the property also features a convenient bike shed and back entrance. Located in the vibrant heart of Leiden, with stores, restaurants and cafes within walking distance. In addition, you are within minutes at the railway station of Leiden."
https://www.pararius.com/apartment-for-rent/den-haag/4c87197a/kepplerstraat,€784 per month,2562 VM (Valkenboskwartier),23 m²,€784 per month,"Description Neat 2-room apartment available in the charming Regentessekwartier! The property is within walking distance of public transport and the lively shopping streets Weimarstraat and Fahrenheitstraat. You’ll also find the cozy Regentesseplein with its terraces just around the corner, and by bike, you’re only 10 minutes away from the city center of The Hague and the beautiful Scheveningen beach. LAY-OUT: Entrance at street level, leading to the communal area. You take the stairs to the 1st floor, where the apartment is located at the front. Front door, entrance to the apartment into the cozy living room of approximately 14 m². Open kitchen equipped with a stove and extractor hood. Bedroom of approximately 5 m². Bathroom with shower, sink, and toilet.                 "
https://www.pararius.com/apartment-for-rent/rotterdam/93d836d8/beijerlandselaan,"€1,010 per month",3074 EB (Hillesluis),63 m²,"€1,010 per month","Description This area embraces the rich melting pot of cultures that make Rotterdam so vibrant. From lively streets to hidden gems, here you will find a harmonious blend of diversity and charm. We have a wonderful 4-room apartment available, perfect for a couple! Interested? Respond quickly via our website. LAY-OUT: Entrance at street level, leading to the communal area. You take the stairs to the 2nd floor where the apartment is located. Front door, entrance into the apartment in the living room of approximately 27 m². Open kitchen equipped with a stove, refrigerator, extractor hood, and combi microwave. Three bedrooms: two located at the rear of approximately 6 m² and 11 m², and one located at the front of approximately 9 m². From the cozy bedroom at the rear, you have access through French doors to the balcony at the back. Bathroom equipped with a shower, sink, and toilet.                  "
https://www.pararius.com/apartment-for-rent/amsterdam/68886d2c/welnastraat,"€2,750 per month",1096 GJ (Omval/Overamstel),78 m²,"€2,750 per month","Description ENERGLY LABEL A+++ (ONLY €30 utility costs per month) Amazing 2022 build and spacious furnished apartment for rent in the new popular area ""Amstelkwartier"" in Amsterdam. ""Amstelkwartier"" is a new residential location in the middle of Amsterdam, yet close to greenery and nature on the border of South and East. The Amstel river is located at the end of the street and via the bridge you can cycle within 5 minutes to Amsterdam South or the trendy Pijp. Public transport is nearby with the Amstel station and Spaklerweg metro station within walking distance. Ring A-10, A-1 and A-2 are also very close by. The Stadshaven Amstelkwartier is within walking distance.                      "
https://www.pararius.com/apartment-for-rent/amsterdam/0fffcc34/gedempte-begijnensloot,"€2,250 per month",1012 PP (Burgwallen-Nieuwe Zijde),60 m²,"€2,250 per month","Description In a beautiful, quiet location behind the Begijnhof in the historic center of Amsterdam you will find this beautifully renovated 1 bedroom apartment on the second and top floor with balcony and storage room. Central entrance with stairs to the 2nd floor where the entrance of the apartment is located. Entry into the large and bright living room with high ceilings and beautiful beam structure. Modern open kitchen with a fridge with freezer, combi-oven, dishwasher and an induction hob with extractor. Through the hallway you reach the bedroom at the rear with access to the balcony. The modern bathroom has a shower and sink. Separate toilet with hand basin and a separate room for the washing machine and dryer. The entire apartment has a beautiful herringbone floor. A spacious private storage room is available on the ground floor.    "
https://www.pararius.com/apartment-for-rent/delft/c727eee6/brabantse-turfmarkt,"€1,200 per month",2611 CP (Centrum),36 m²,"€1,200 per month",Description Comfortable apartment for rent in Delft in the Centrum district.
https://www.pararius.com/apartment-for-rent/delft/99c72ce8/brabantse-turfmarkt,"€1,200 per month",2611 CP (Centrum),41 m²,"€1,200 per month",Description Nice apartment for rent in Delft in the Centrum district.
https://www.pararius.com/apartment-for-rent/amsterdam/7f281940/prins-hendrikkade,"€2,500 per month",1011 AJ (Nieuwmarkt/Lastage),85 m²,"€2,500 per month","Description Furnished 1-Bedroom apartment (approx. 85m2) located on the 1st floor at the Prins Hendrikkade. (Center - Central Station - Nieuwmarkt). *A lay out and a video can be found on our website of kkamsterdam. Layout:
Steep stairs to the first floor.                    "
https://www.pararius.com/apartment-for-rent/bennekom/a99cecfd/dorpsstraat,"€2,400 per month",6721 JK (Boekelo),140 m²,"€2,400 per month","Description We can offer a completely new apartment on the second floor in the pleasant center of Bennekom. (Apartment top view)The high-quality finished and fully furnished apartment has generous dimensions (+/-140 m2) and has a loggia. The carefully chosen interior has a warm ambiance with stylish furniture. The attractive furnishings and complete equipment mean that the apartment is ready to be occupied immediately. Everything has been thought of, so that you only have to take your personal belongings with you and you can move in. The apartment is accessible via a spacious hall with stairs and/or elevator. You can enter terrace through the sliding doors with an unobstructed view of the cozy center of Bennekom. The house is conveniently located in relation to the A12 and A30 and is within cycling distance of the WUR in Wageningen (5 minutes) and Ede/Wageningen station. (10 minutes)                      "
https://www.pararius.com/apartment-for-rent/groningen/38820f02/coendersweg,"€1,495 per month",9722 GK (Helpman),94 m²,"€1,495 per month","Description Beautiful, spacious upstairs apartment (approx. 94m2) in Helpman with three bedrooms and a balcony. Ideal for a working couple or working person. Not suitable for more than 2 unattached persons. Layout
Entrance hall with stairs to the first floor, through the hall access to kitchen with appliances, separate toilet with sink, spacious living room (approx. 31 m2) with access through French doors to the balcony. Layout              "
https://www.pararius.com/apartment-for-rent/haarlem/cbf65aea/lange-vijfmatlaan,"€2,180 per month",2035 LG (Romolenpolder-oost),84 m²,"€2,180 per month",Description Lovely furnished or uphostered apartment with balcony for rent in Haarlem with 2 bedrooms in the Romolenpolder-oost district.
https://www.pararius.com/apartment-for-rent/amsterdam/0f0707c8/balthasar-floriszstraat,"€2,900 per month",1071 VB (Museumkwartier),93 m²,"€2,900 per month","Description In central Amsterdam on a great location a double floor house (semi furnished), with 2 bedrooms and a spacious garden (appr.60m2). Located in a quiet street nearby several shops, pubs and restaurants with Museumplein, Vondelpark and Albert Cuypmarkt on walking distance. The exits to the highway Ring-A10 and the train station Amsterdam-Zuid/WTC are very easy to reach.     "
