Link,Huurprijs,Locatie,m2,Huurovereekomst,Beschrijving
https://www.pararius.com/apartment-for-rent/amsterdam/6ead59ad/anna-blamansingel,"€2,150 per month",1102 ST (Venserpolder),99 m²,"€2,150 per month","Description 2 BEDROOMS || 99 m2 || FULLY FURNISHED || AMSTERDAM || PARKING GARAGE || AVAILABLE IMMEDIATELY This large furnished 2-bedroom apartment with optional private, secure parking is available immediately. Public transportation is just a few walking minutes away (metro 50, 54 and NS train station) creating a smooth connection to the city center, Zuidas or Schiphol Airport. The main highways are in close proximity and can be easily reached.                 "
https://www.pararius.com/apartment-for-rent/bussum/287cd4ab/spiegeldwarsstraat,"€1,950 per month",1405 HS (Spiegelzicht),111 m²,"€1,950 per month",Description Charming apartment with balcony for rent in Bussum with 2 bedrooms in the Spiegelzicht district.
https://www.pararius.com/apartment-for-rent/rotterdam/f158c3f4/weena,"€2,345 per month",3013 CG (Stadsdriehoek),86 m²,"€2,345 per month","Description What a place!
Beautifully located furnished 3-room apartment on the 11th floor with a phenomenal view over the Hofplein, the fountain and the skyline of Rotterdam center! The apartment is located in the heart of Rotterdam, you can't live more centrally! The house has a playful layout with a round facade, spacious living room with open kitchen and 2 bedrooms.  The Weena is located in the most central part of Rotterdam, on the Hofplein, the beating heart of the city. You look out over the Coolsingel and every evening you can enjoy the beautifully lit City Hall. With this urban location you have everything within reach; from a message at the Albert Heijn on the Coolsingel, a drink at Biergarten, a fun party at Annabel, a concert at De Doelen or Oude Luxor, or a movie at Pathé Schouwburgplein, you will find it all within walking distance! The railway station and metro and tram stops are all nearby. The roads are also easily accessible; the A13 and A20 can be reached within 5 to 10 minutes.                  "
https://www.pararius.com/apartment-for-rent/eindhoven/a1b66d67/grasbaan,"€1,975 per month",5658 ER (Grasrijk),110 m²,"€1,975 per month","Description Spacious and fully furnished 3-room apartment situated on the 3rd floor of a new built apartment complex on the side of Eindhoven in ‘Meerhoven’ and close to the highway and Eindhoven Airport.
The apartment is provided with a private parking space and bicycle storage in the basement of the building.  Lay-out:
Main entrance with videophone installation, letter boxes, staircase and entrance to the elevator.
3rd floor: Corridor with meter cupboards.
Entrance: Hallway with access to the storage room with heating system, washing machine, dryer, freezer and cupboards. Guest toilet with washing basin. Spacious living room of app.40 m2 provided with a laminate floor, sitting- and dining area and access by a large glass sliding door to a balcony of appr.10 m2 with a great view over sport fields and trees.
Open kitchen with all built-in equipment like a cooker + hood, fridge, dishwasher and microwave / oven combination.
1st bedroom of app.10 m2 provided wit a single bed, TV and working space. Master bedroom of app.15 m2 with a double bed. Bathroom with a bath, shower, basin and cupboard.       "
https://www.pararius.com/house-for-rent/maartensdijk/f2edc6b5/distelvink,"€1,995 per month",3738 SK (Maartensdijk Kern),116 m²,"€1,995 per month",Description Charming upholstered house with garden for rent in Maartensdijk with 4 bedrooms in the Maartensdijk Kern district.
https://www.pararius.com/apartment-for-rent/maastricht/c341b1e5/einsteinstraat,"€1,490 per month",6227 BX (Heer),140 m²,"€1,490 per month",Description Apartment for rent in Maastricht with 3 bedrooms in the Heer district.
https://www.pararius.com/apartment-for-rent/amsterdam/31b3371c/arent-janszoon-ernststraat,"€2,650 per month",1083 GS (Buitenveldert-Oost),110 m²,"€2,650 per month","Description This pretty and bright and spacious 110 m², fully furnished apartment is a fantastic rental opportunity in the heart of Amsterdam Zuid. Located on AJ Ernststraat, this apartment features two large terraces, allowing you to enjoy plenty of natural light throughout the day. Located on the 6th Floor accessed by elevator and overlooking green spaces, the serene setting is perfect for those looking for both comfort and tranquility.            "
https://www.pararius.com/apartment-for-rent/amsterdam/e20b439d/lauriergracht,"€4,500 per month",1016 RJ (Jordaan),120 m²,"€4,500 per month","Description Spacious Three-Bedroom Apartment with outside space over 2 floors, located on the Picturesque Lauriergracht Canal Nestled along the beautiful Lauriergracht canal in the heart of Amsterdam, this expansive three-bedroom apartment offers a perfect combination of historic charm and modern comfort. Spread across 2 levels, this residence is thoughtfully designed to provide both privacy and luxury.        "
https://www.pararius.com/apartment-for-rent/eindhoven/74e10efa/oranjestraat,"€1,267 per month",5611 JH (Bergen),30 m²,"€1,267 per month",Description This loft is fully furnished and will be rented for a maximum period of 24 months (minimum 6 months). This building is located within 5 minutes of the City Centre of Eindhoven! Maximum of 1 people. The loft and the building have the following features: Kitchen:                        
https://www.pararius.com/apartment-for-rent/eindhoven/78e1f992/stationsplein,"€2,245 per month",5611 BB (Binnenstad),120 m²,"€2,245 per month","Description Type: 3-room apartment
Location: Center / Eindhoven  Very luxurious and fully upholstered and furnished 3-room apartment in the center of Eindhoven with, among other things, a spacious balcony, private parking space located in the basement and the house also offers a view over the cozy Stationsplein. Also easy; there is a spacious private storage room available on the ground floor.         "
https://www.pararius.com/apartment-for-rent/amsterdam/8f6100a2/bijlmerdreef,"€2,000 per month",1103 TX (Ganzenhoef e.o.),74 m²,"€2,000 per month",Description Beautiful upholstered apartment with balcony for rent in Amsterdam with 2 bedrooms in the Ganzenhoef e.o. district.
https://www.pararius.com/house-for-rent/spijkenisse/0ce74385/phobospad,"€2,200 per month",3204 TJ (Sterrenkwartier-Oost),125 m²,"€2,200 per month","Description 123Wonen Dé Verhuurmakelaar offers: Spacious family house with garden! Located in the district Sterrenkwartier we may offer you this totally renovated (Dec 2022) very spacious family house with garden. New kitchen, new bathroom, new toilet and completely upholstered and furnished.
The house is characterized by the cozy and large living room, spacious bedrooms, large attic and sunny backyard facing west. Within walking distance are several exit roads such as the shopping center of Sterrenkwartier, schools, playgrounds and public transport. Working in the Randstad and still want to live quietly? Then this is the solution! In short, a picture on a fine residential location. Do you see yourself living here already? Please contact us to request a viewing.                          "
https://www.pararius.com/apartment-for-rent/uitgeest/a263aafe/lagendijk,"€1,905 per month",1911 MT (Buitengebied),90 m²,"€1,905 per month",Description Lovely apartment with garden for rent in Uitgeest with 2 bedrooms in the Buitengebied district.
https://www.pararius.com/apartment-for-rent/den-haag/cfc04d9d/muzenplein,"€2,250 per month",2511 GD (Uilebomen),77 m²,"€2,250 per month","Description This two-bedroom apartment with energy label A is located in a residential area in the heart of The Hague, offering the perfect balance between tranquillity and bustling city life. The apartment has a large rooftop terrace at the front, offering an exceptional outdoor space, along with two additional balconies, allowing you to enjoy the sun all day long. Just a short walk away, you’ll find yourself in the vibrant city center, with The Plein and the Binnenhof reachable within 5 minutes. The nearby Central Station is within walking distance and public transportation is highly accessible, with several tram and bus lines nearby.                  "
https://www.pararius.com/apartment-for-rent/amsterdam/3c6ba743/osdorpplein,"€1,918 per month",1068 TD (Osdorp-Oost),64 m²,"€1,918 per month","Description Are you interested in the house and do you want a viewing?
Please leave a written response to the advertisement, we will then invite the first candidates for a viewing.
Unfortunately, due to the many requests, we can’t invite everyone. If you have not received a response within 3 days, you have unfortunately not been selected to view the apartment. We don’t schedule appointments by telephone.                         "
https://www.pararius.com/apartment-for-rent/rotterdam/11c58f6d/maaskade,"€1,875 per month",3071 NB (Noordereiland),70 m²,"€1,875 per month",Description Beautiful apartment with balcony for rent in Rotterdam with 2 bedrooms in the Noordereiland district.
https://www.pararius.com/house-for-rent/rotterdam/6d15d742/kerstant-van-den-bergelaan,"€3,000 per month",3054 EP (Hillegersberg Noord),151 m²,"€3,000 per month",Description Spacious house with garden for rent in Rotterdam with 3 bedrooms in the Hillegersberg Noord district.
https://www.pararius.com/house-for-rent/den-haag/d1640234/miamihof,"€2,750 per month",2548 JB (Hoge Veld),135 m²,"€2,750 per month",Description Conveniently located house with garden for rent in Den Haag with 3 bedrooms in the Hoge Veld district.
https://www.pararius.com/apartment-for-rent/amsterdam/4e30c85b/tweede-jan-van-der-heijdenstraat,"€2,790 per month",1074 XS (Oude Pijp),75 m²,"€2,790 per month","Description In a quiet part of the Pijp, we offer this spacious, fully furnished two-bedroom apartment, offering approximately 75 m² of comfortable living space. LAYOUT LAYOUT Situated on the fourth and top floor, the apartment features a beautiful inlaid parquet floor throughout. The bright and airy living room, along with the modern kitchen, is located at the rear and opens onto a newly renovated balcony overlooking the inner garden.                   "
https://www.pararius.com/house-for-rent/amstelveen/ac071568/noorddammerlaan,"€4,950 per month",1185 XZ (Bovenkerk),220 m²,"€4,950 per month","Description pectacular villa available in Amstelveen, the villa comes fully furnished with three bedrooms, two ensuite bathrooms, two private parking spaces as well as a beautiful terraced backyard. Amazing three bedroom villa located in Amstelveen available immidiately. This home comes fully furnished and offers a luxurious interior and a typically Dutch exterior. This traditional dyke house has been recently renovated and offers a massive open living area with a beautiful, high-end kitchen and a bright dining area with double doors going out to the large garden with outdoor kitchen. The terraced garden with outdoor kitchen is south facing and can be enjoyed year round. There are three good sized bedrooms and two ensuite bathrooms on the first floor.                        "
https://www.pararius.com/apartment-for-rent/amsterdam/6fc83bc2/mercatorstraat,"€2,200 per month",1056 RH (Van Galenbuurt),65 m²,"€2,200 per month","Description NOT SUITABLE FOR SHARERS, PLEASE RESPOND BY E-MAIL WHEN INTERESTED For rent for 6 months a beautiful 1 BR apartment (65M2) in 'de Baarsjes' with 2 Balconies. Recently renovated spacious apartment in the lively 'Baarsjes'. Both interior and furnishing have been renewed, you will move-in to a new and fresh apartment equipped with all utilities and comfort. The whole apartment has generous beautiful light fall, and there are two balconies where you can enjoy the first sunny days in spring. Besides the living- and master bedroom there is a spare room which can be used as home-office. In the area there are several parks, shops, nice restaurants, cafe's and cultural establishments where you can enjoy your spare time.             "
https://www.pararius.com/apartment-for-rent/amsterdam/d8d3fb21/jan-olphert-vaillantlaan,"€1,950 per month",1086 XZ (IJburg-West),41 m²,"€1,950 per month","Description Very nice and modern apartment of approx. 41m2 with garden of approx. 25m2! The apartment is located on Steigereiland, the first island of IJburg. LAYOUT private entrance at street level
very bright living / dining room at the front private entrance at street level very bright living / dining room at the front                   "
https://www.pararius.com/apartment-for-rent/rotterdam/4f26bebc/boompjes,"€1,995 per month",3011 XZ (Stadsdriehoek),76 m²,"€1,995 per month","Description Fantastic and fully furnished 2-bedroom apartment (with parking) with a stunning view over the Maas and the Erasmusbrug. You have the vibrant city energy all around. Nestled in the heart of Rotterdam, De Boompjes offers everything you need. Enjoy a short stroll to the bustling city center filled with trendy restaurants, cozy cafés, and boutique shops. With excellent public transport connections, you can reach your favorite destinations in no time. Ground floor: closed entrance with elevator, doorbells, and mailboxes.               "
https://www.pararius.com/house-for-rent/groningen/50aebdb8/visserstraat,"€1,650 per month",9712 CZ (Binnenstad-Noord),88 m²,"€1,650 per month",Description Lovely house for rent in Groningen with 2 bedrooms in the Binnenstad-Noord district.
https://www.pararius.com/room-for-rent/zwolle/bfdaaed6/celestraat,€317 per month,8012 TV (Oud-Assendorp),14 m²,€317 per month,"Description BEAUTIFUL SPACIOUS ROOM WITH BUILT-IN CLOSET IN THE ASSENDORP NEIGHBORHOOD INTERESTED? You can leave a response via the Maxx website by clicking on 'Yes, I am interested'. We cannot process your response by phone. After scheduling a viewing with the current resident, candidates who have responded to the property will be invited in chronological order. So, respond as quickly as possible!            "
https://www.pararius.com/room-for-rent/zwolle/c62b72a6/molenweg,€547 per month,8012 WN (Oud-Assendorp),22 m²,€547 per month,"Description SEMI-STUDIO IN COZY NEIGHBORHOOD ASSENDORP INTEREST? You can leave a reaction via the website of Maxx by clicking on 'Yes I am interested'. We can not take your reaction by phone. After scheduling viewings with the current occupant, candidates who have responded to the property will be invited in chronological order. So please respond as soon as possible!            "
https://www.pararius.com/apartment-for-rent/amsterdam/24ddb01c/oudezijds-voorburgwal,"€1,900 per month",1012 ES (Burgwallen-Oude Zijde),65 m²,"€1,900 per month","Description Great Location , 1 bedroom apt furnished only for a working person or 1 student Price is inclusif . Available 1/11 Price is incl utilities"
https://www.pararius.com/apartment-for-rent/zoetermeer/55fd859e/blauw-roodlaan,"€2,100 per month",2718 SJ (Lansinghage c.a.),106 m²,"€2,100 per month","Description Unfurnished 4-room apartment located on the 1st floor of a detached villa. Located in the Zoetermeer district of Rokkeveen and a short distance from the park, (primary) schools, district shopping centers Rokkeveen and De Vlieger, public transport, sports facilities and the railway station. Directly near roads to the highways to The Hague and Utrecht (A12 >2 min) and Amsterdam (A4 >13 min). Layout:             "
https://www.pararius.com/apartment-for-rent/eindhoven/8bd15407/hoogstraat,"€1,599 per month",5615 PW (Schrijversbuurt),58 m²,"€1,599 per month","Description Furnished recently renovated apartment located in a top location within the ring road. The center of Eindhoven is a stone's throw away. ASML and the High Tech Campus are very conveniently located. Supermarket located across the street from the apartment. The apartment is located on the 3rd floor of a small-scale apartment complex. Through the hall you enter a spacious living room with open kitchen. The space enjoys a lot of light through the large windows. The kitchen has a practical breakfast bar. The kitchen is equipped with a gas hob, extractor hood, refrigerator, combi oven and sufficient storage space.    "
https://www.pararius.com/house-for-rent/duivendrecht/ea73c335/in-de-houtzaagmolen,"€2,600 per month",1115 GE (Duivendrecht),127 m²,"€2,600 per month","Description Discover this beautiful family home located in a quiet, child-friendly neighborhood just outside Amsterdam. This property offers the perfect blend of comfort and location, with excellent public transport connections and a variety of shops nearby, including supermarkets and the charming Dorpsplein shopping center. Upon entering the hallway, you’ll find a coat area and a separate toilet. The spacious living room features an open kitchen and provides access to the sunny garden, where you can relax on the terrace by the water, perfect for warm summer days.            "
https://www.pararius.com/apartment-for-rent/rotterdam/0ec2c4a1/kouwenoord,"€1,600 per month",3079 LD (Groot IJsselmonde),79 m²,"€1,600 per month",Description Apartment with balcony for rent in Rotterdam with 2 bedrooms in the Groot IJsselmonde district.
https://www.pararius.com/apartment-for-rent/eindhoven/56a38308/hoogstraat,"€1,125 per month",5654 NG (Blaarthem),40 m²,"€1,125 per month","Description **Stylish studio in a charming city villa! Are you looking for a tasteful and comfortable living space in a prime location? This recently renovated, fully unfurnished studio in a characteristic city villa close to the bustling city center offers exactly what you are looking for! Highlights of the studio: Highlights of the studio:                          "
https://www.pararius.com/house-for-rent/landgraaf/f30206b9/rector-meussenstraat,"€1,250 per month",6371 HG (Leenhof),105 m²,"€1,250 per month",Description 928598 928598 Attention! You can only request a viewing online via this website. Please state the following information in your viewing request: 1. Number of adults who will live in the house                                         
https://www.pararius.com/apartment-for-rent/amsterdam/375eb22d/gerard-brandtstraat,"€2,559 per month",1054 JK (Vondelparkbuurt),61 m²,"€2,559 per month","Description For viewing please contact us via e-mail. Available October 15th 2024. Fantastic, completely renovated and furnished apartment (+/-61m2) on the 3rd floor, located on the edge of the beautiful Vondelpark!                                            "
https://www.pararius.com/apartment-for-rent/amsterdam/5ab48d51/looiersgracht,"€2,600 per month",1016 VT (Jordaan),49 m²,"€2,600 per month",Description Tastefully furnished one-bedroom house spanning 49 sq.m. This charming apartment is located in the desirable and central Jordaan district and features a large balcony. We are looking for a tenant who can move in on the 1st of November 2024. The gross yearly income requirement is 110K. Home-sharing and pets are not permitted. Students are allowed with guarantors. LIVING AREA LIVING AREA                                                         
https://www.pararius.com/house-for-rent/veldhoven/4879c89a/bree,"€1,500 per month",5501 JA (Cobbeek en Centrum),103 m²,"€1,500 per month","Description For rent in the center of Veldhoven City this furnished maisonette with garden and garage. The property is within walking distance of various shopping facilities and near roads to, among others, ASML and the High Tech Campus. Layout: Ground floor:
Entrance into the hall of the house on the ground floor with passage to bedroom 1, 2, the storage room and staircase. Bedroom 1 of approx. 6 m2 with carpet. Bedroom 2 of approx. 22 m2 with access to bathroom and garden. Luxuriously finished bathroom with walk-in shower, bath, sink, second toilet and is fully tiled. Garden with terrace and lawn. Separate storage room with washing machine.      "
https://www.pararius.com/house-for-rent/de-bilt/3d0a1784/aeolusweg,"€2,200 per month",3731 XE (De Bilt West),110 m²,"€2,200 per month","Description Charming and Cozy Family Home in De Bilt, Just Outside Utrecht-East Charming and Cozy Family Home in De Bilt, Just Outside Utrecht-East Location: Location: De Bilt is located just outside Utrecht, and within a 17-minute bike ride, you can reach De Neude. In the village, you can park for free, and there are good connections to the A27 and A28, as well as bus connections to Utrecht. In short, Utrecht is always close by! The Uithof of Utrecht is only 14 minutes of cycling.           "
https://www.pararius.com/house-for-rent/maastricht/d79be399/professor-mullerstraat,"€1,850 per month",6224 BC (Wyckerpoort),117 m²,"€1,850 per month","Description THIS PROPERTY IS NOT AVAILABLE FOR STUDENTS OR SHARED LIVING ARRANGEMENTS. THIS PROPERTY IS NOT AVAILABLE FOR STUDENTS OR SHARED LIVING ARRANGEMENTS. Located near the International School (UWC), Maastricht Central Station, the Groene Loper, and the Wyck district, this family home with 4 bedrooms, a garden, and a garage is available for rent. The property is conveniently and quietly situated, with the nearby 'Cruyff Court Field' offering outdoor fitness equipment, a football field, and a playground.           "
https://www.pararius.com/room-for-rent/groningen/f455f4b3/korreweg,€687 per month,9714 AE (Professorenbuurt),14 m²,€687 per month,Description Pleasant room for rent in Groningen in the Professorenbuurt district.
https://www.pararius.com/apartment-for-rent/groningen/f8b2cdc6/noorderbuitensingel,"€1,000 per month",9717 KK (Noorderplantsoenbuurt),35 m²,"€1,000 per month",Description Comfortable apartment for rent in Groningen with 1 bedroom in the Noorderplantsoenbuurt district.
https://www.pararius.com/apartment-for-rent/den-haag/b52da1d8/nassauplein,"€3,750 per month",2585 EC (Archipelbuurt),170 m²,"€3,750 per month","Description Beautiful newly renovated ground floor apartment with energy label A, in the lovely Archipelbuurt with original details from the 1900s and a spacious backyard. The renovations have just finished and it is now ready to welcome you as its first tenant! Within walking distance, there is the Bankastraat, where you can find several boutiques, lunch rooms, restaurants and shops. The apartment is conveniently located within walking distance from multiple international organizations and embassies. The highways to Rotterdam Utrecht and Amsterdam are close by and can easily be reached. Public transport is very near and to reach Central Train station it only takes a 3-minute tram ride or a 10-minute walk. Last but not least, the beach and the boulevard can easily be reached by bike or public transport.                 "
https://www.pararius.com/house-for-rent/arnhem/4fe5314d/dalweg,"€2,100 per month",6821 JL (Sonsbeek-Noord),113 m²,"€2,100 per month","Description Use the button “Plan a viewing” or “Contact the estate agent” on this page! EXCL. G/W/E/TV/Wifi. Deposit 2 months. Pets are not allowed. This charming 1930s house will be available from December 1st. In one of the most desirable neighborhoods of Arnhem, Sint Marten, is this charming and renovated house with a large garden facing south and with a garage. Close to the city, the Sonsbeek park and also arterial roads such as the A12 and A50 can be reached within 5 minutes.
The house is fully insulated, contains a recently replaced luxury kitchen and luxury bathroom with separate shower and bath.                      "
https://www.pararius.com/apartment-for-rent/amsterdam/be4fdb81/valkenburgerstraat,"€2,650 per month",1011 LZ (Nieuwmarkt/Lastage),89 m²,"€2,650 per month","Description A spacious, newly renovated and modern 2 bedroom furnished apartment with elevator access, located in Amsterdam City Center. There is a bright, sunny and large living and dinning area with beautiful picture windows, this leads to a semi-open kitchen with all modern appliances, luxury work surfaces and lots of space for cooking.       "
https://www.pararius.com/apartment-for-rent/utrecht/7cf9282d/oudegracht,€972 per month,3511 AD (Wijk C),29 m²,€972 per month,Description Comfortable apartment with garden for rent in Utrecht with 1 bedroom in the Wijk C district.
https://www.pararius.com/room-for-rent/groningen/53f6d45c/helper-westsingel,€528 per month,9721 BG (Helpman),15 m²,€528 per month,Description Pleasant room for rent in Groningen in the Helpman district.
https://www.pararius.com/apartment-for-rent/groningen/a73631d1/parkweg,"€1,031 per month",9725 EA (Rivierenbuurt),25 m²,"€1,031 per month",Description Comfortable apartment for rent in Groningen with 1 bedroom in the Rivierenbuurt district.
https://www.pararius.com/apartment-for-rent/arnhem/20875b71/koningstraat,"€1,148 per month",6811 DG (Markt),79 m²,"€1,148 per month","Description Beautiful, spacious 2-room apartment with a balcony located on Koningstraat, right in the center of Arnhem. This stunning apartment is on the second floor, has recently been renovated, and comes with an A+ energy label. It is neatly finished and is delivered semi-furnished, ready to move in! Koningstraat is a lively street with various shops and plenty of cozy dining establishments. For daily groceries, you can easily walk to the nearby Spar, and for relaxation, you can visit the beautiful Sonsbeek City Park.                  "
https://www.pararius.com/apartment-for-rent/den-bosch/9a2510e4/schubertsingel,"€2,250 per month",5216 XA (Zuid),78 m²,"€2,250 per month",Description Beautiful apartment for rent in Den Bosch with 2 bedrooms in the Zuid district.
