Link,Huurprijs,Locatie,m2,Huurovereekomst,Beschrijving
https://www.pararius.com/apartment-for-rent/nootdorp/78408f91/dorpsstraat,"€1,525 per month",2631 CV (Nootdorp CentrumWest),74 m²,"€1,525 per month","Description Are you interested in renting this property?
We ask you to send an email (******) to express your interest. In this email, we ask you to provide information about your current situation, such as your family, your financial situation and the reason you are looking for a new rental home.  You will find this unfurnished 3-room apartment on a perfect location in Nootdorp on the first floor of this small-scale apartment complex with a balcony and private parking space on the ground floor. The house is centrally located in relation to the shopping center 'Parade Nootdorp' and public transport. In addition, there is a good connection with the various roads such as highways A12, A13 and A4 and the recreational lake and area ''De Dobbeplas'' is within cycling distance. Rental price is € 1.525,- per month excluding € 50,- service costs and excluding G/W/E/TV and internet. Available per November 1st, 2024.                                                            "
https://www.pararius.com/apartment-for-rent/delft/9bd96077/arthur-van-schendelplein,"€1,525 per month",2624 CZ (Voorhof-Hoogbouw),94 m²,"€1,525 per month","Description Are you interested in renting this property?
We ask you to send an email (******) to express your interest. In this email, we ask you to provide information about your current situation, such as your family, your financial situation and the reason you are looking for a new rental home.  Spacious 4-room apartment on the seventeenth floor with balcony and private storage room in the basement, located in the Voorhof district. The house is centrally located in relation to the shopping center 'In de Hoven' and public transport. There is a good connection with the various roads. In addition, the city center is 5 minutes by bike and Delft station is also within walking distance. There is a particularly spacious playground and a community center next to the car park. Rent is € 1.525,- per month excluding € 207,- in heating costs and other service costs, excluding G/W/E/TV and internet. Available: in negotiation, approx. starting December 1st, 2024.                              "
https://www.pararius.com/apartment-for-rent/amsterdam/2ef610db/zocherstraat,"€2,350 per month",1054 MA (Overtoomse Sluis),54 m²,"€2,350 per month","Description Tastefully [furnished] one-bedroom apartment of 54 m2, located on the 2nd floor. The apartment has a bay window with views of Vondelpark located across the street. The apartment is available immediately. The gross yearly income requirement for this apartment is 100 K. Students are not allowed. Pets are allowed on request. LIVING ROOM AND DINING AREA LIVING ROOM AND DINING AREA                                                     "
https://www.pararius.com/room-for-rent/tilburg/1d8f37fc/hoefstraat,€598 per month,5014 NP (Hoefstraat Zuid),20 m²,€598 per month,Description Room for rent in Tilburg in the Hoefstraat Zuid district.
https://www.pararius.com/apartment-for-rent/noordwijk-zh/8551aeae/abraham-van-royenstraat,"€1,515 per month",2202 EP (Kern Zee),138 m²,"€1,515 per month","Description For rent: Luxury renovated apartment at Abraham van Royenstraat 104H in Noordwijk For rent: Luxury renovated apartment at Abraham van Royenstraat 104H in Noordwijk This beautiful renovated apartment is available from November 1 and is located in the heart of Noordwijk aan Zee. The house extends over three floors: the basement, first and second floor. The apartment offers modern luxury and comfort, just a 5-minute walk from the beach, the bustling shopping street Hoofdstraat and various catering establishments.            "
https://www.pararius.com/apartment-for-rent/rotterdam/4fb5816b/robert-baeldestraat,"€1,900 per month",3061 TJ (Kralingen West),77 m²,"€1,900 per month","Description *****AVAILABLE FOR 5 MONTHS, DECEMBER 1, 2024 UNTIL MAY 1, 2025* *** *****AVAILABLE FOR 5 MONTHS, DECEMBER 1, 2024 UNTIL MAY 1, 2025* *****AVAILABLE FOR 5 MONTHS, DECEMBER 1, 2024 UNTIL MAY 1, 2025* *****AVAILABLE FOR 5 MONTHS, DECEMBER 1, 2024 UNTIL MAY 1, 2025* *****AVAILABLE FOR 5 MONTHS, DECEMBER 1, 2024 UNTIL MAY 1, 2025* *****AVAILABLE FOR 5 MONTHS, DECEMBER 1, 2024 UNTIL MAY 1, 2025* *****AVAILABLE FOR 5 MONTHS, DECEMBER 1, 2024 UNTIL MAY 1, 2025* *****AVAILABLE FOR 5 MONTHS, DECEMBER 1, 2024 UNTIL MAY 1, 2025* **** Located in the heart of Kralingen, a fully furnished three-room apartment with a west-facing balcony. Located on the 6th floor of the striking Kralingse apartment complex ""De Plantage"". The kitchen is equipped with a gas hob, dishwasher, combination microwave and refrigerator with freezer.      "
https://www.pararius.com/apartment-for-rent/rotterdam/651785eb/westplein,"€1,995 per month",3016 BM (Nieuwe Werk),82 m²,"€1,995 per month","Description Beautiful and spacious unfurnished 2-room apartment on the 3rd floor of the monumental Atlantic House in an absolute prime location in the bustling Scheepvaartkwartier.
The Scheepvaartkwartier has fast connections to the Ring of Rotterdam via the Maasboulevard, the Maastunnel traverse and the Erasmus Bridge. Diagonally opposite the entrance you will find the tram stop for line 7 (you are at Rotterdam Central in 7 minutes), the bus and water taxi and metro stops are a few minutes' walk away.                      "
https://www.pararius.com/apartment-for-rent/amsterdam/1247b97d/van-oldenbarneveldtstraat,"€2,450 per month",1052 JN (Frederik Hendrikbuurt),56 m²,"€2,450 per month",Description Nice upholstered apartment with garden for rent in Amsterdam with 2 bedrooms in the Frederik Hendrikbuurt district.
https://www.pararius.com/apartment-for-rent/amsterdam/1a34e048/admiraal-de-ruijterweg,"€2,350 per month",1055 NE (Landlust),61 m²,"€2,350 per month","Description ADMIRAAL DE RUIJTERWEG (CA. 61M2) AMSTERDAM-WEST / BOS EN LOMMER VIEWINGS VIA WEBSITE AND NOT BY PHONE!
NOT SUITABLE FOR SHARERS AND TENANTS WITH GUARANTORS
SEE VIDEO ON OUR WEBSITE   Layout:
At the front is the living room (ca.4.72 x 4.19 = 19.68m2) with access to the first bedroom (ca. 2.94 x 2.37 = 7.00m2).
On the garden side is the kitchen (ca.2.96 x 5.32 = 15.78m2) which is accessible from the living room and is equipped with a 4-burner induction hob, dishwasher, microwave/oven and large fridge/freezer and has access to the balcony. The master bedroom (ca.3.58 x 2.94 = 10.58m2) with access to the same balcony as the kitchen.
The bathroom has a walk-in shower and toilet.      "
https://www.pararius.com/apartment-for-rent/noordwijk-zh/b2ecd4cb/abraham-van-royenstraat,"€1,465 per month",2202 EN (Kern Zee),138 m²,"€1,465 per month","Description For rent: Luxurious renovated apartment on the Abraham van Royenstraat 104I in Noordwijk For rent: Luxurious renovated apartment on the Abraham van Royenstraat 104I in Noordwijk This beautifully renovated apartment is available from November 1 and is located in the heart of Noordwijk aan Zee. The property extends over three floors: the basement, first and second floor. The apartment offers modern luxury and comfort, just 5 minutes walking distance from the beach, the bustling shopping street the Main Street and various catering establishments.             "
https://www.pararius.com/apartment-for-rent/amsterdam/166c2b0d/linnaeusparkweg,"€3,050 per month",1098 EP (Middenmeer),122 m²,"€3,050 per month","Description LINNAEUSPARKWEG (ca. 120m2) AMSTERDAM-OOST / MARIOTTEPLEIN VIEWINGS VIA WEBSITE AND NOT BY PHONE
NOT SUITABLE FOR STUDENTS/GUARANTORS  Unfurnished 3-bedroom apartment on the ground floor with a spacious garden and a shed.      "
https://www.pararius.com/apartment-for-rent/amsterdam/4f6da30e/van-spilbergenstraat,"€3,025 per month",1057 PZ (Hoofdweg e.o.),62 m²,"€3,025 per month","Description This beautiful two-bedroom apartment filled with natural light, spanning 62 sq.m. is now available. The apartment features a large garden, a spacious living room with kitchen, two bedrooms and a bathroom. Home-sharing is permitted, and students are welcome with guarantors. The gross yearly income requirement for this apartment is 125 K. The apartment is available immediately. Van Spilbergenstraat is a charming residential street in Amsterdam West, located in the vibrant De Baarsjes neighbourhood.                                                      "
https://www.pararius.com/house-for-rent/weesp/53e33283/nigtevechtlaan,"€3,500 per month",1384 GN (Waterrijk),146 m²,"€3,500 per month",Description Spacious upholstered house with garden for rent in Weesp with 5 bedrooms in the Waterrijk district.
https://www.pararius.com/apartment-for-rent/rotterdam/2ab7e7b2/zandblokstraat,€930 per month,3083 MZ (Carnisse),65 m²,€930 per month,Description Beautiful apartment with balcony for rent in Rotterdam with 1 bedroom in the Carnisse district.
https://www.pararius.com/room-for-rent/breda/2940d5bd/catharinastraat,€650 per month,4811 XH (City),17 m²,€650 per month,"Description Completely newly renovated student house on the Grote Markt in the center of Breda Central Station, within walking distance to the Valkenberg Park. A student of 17 m2 on the first floor at the rear with direct access to terrace. Right in the thriving center of Breda with shopping opportunities, nightlife and supermarket all within walking distance         "
https://www.pararius.com/apartment-for-rent/schiedam/911abf08/dam,"€1,300 per month",3111 BC (Brandersbuurt),55 m²,"€1,300 per month",Description New for rent beautiful property in Schiedam.
https://www.pararius.com/apartment-for-rent/den-haag/d7fbb773/van-speijkstraat,"€3,250 per month",2518 GH (Zeeheldenkwartier),137 m²,"€3,250 per month","Description Beautiful property with high-quality finishing and energy label C, located in the popular Zeeheldenkwartier area. This lovely property comes with a brand new bathroom, modern kitchen, and sunny private garden. Located within walking distance of shops, restaurants, and lunchrooms. Several International organizations are situated in the immediate area and public transport is close. Layout:
Entrance at street level with video intercom system and alarm system. Hallway with separate toilet and hand washbasin, opening doors that lead into the spacious living and dining room. The living area is freshly painted and equipped with wooden flooring throughout and has beautiful original details, like ornamental ceilings, stained glass, and a mantelpiece. From the dining area, you can access the lovely well-maintained garden, where the sun can be enjoyed throughout the whole day. The modern kitchen is fully equipped and has a big stove with oven, microwave, extractor, and new refrigerator and freezer.          "
https://www.pararius.com/apartment-for-rent/amsterdam/11ba6f38/van-spilbergenstraat,"€2,750 per month",1057 RC (Hoofdweg e.o.),58 m²,"€2,750 per month","Description This stunning, recently renovated three-bedroom apartment, covering 58 sq.m., is now available. The apartment is situated on the first floor and features a balcony. Van Spilbergenstraat is a charming residential street in Amsterdam West, located in the vibrant De Baarsjes neighborhood. The gross yearly income requirement for this apartment is 115 K. We are looking for a tenant who can move in immediately. Home-sharing is allowed and students with solid guarantors are welcome. Pets are allowed in consultation.                                                          "
https://www.pararius.com/house-for-rent/haarlem/f32ed11a/oudeweg,"€1,650 per month",2031 CA (Sportliedenbuurt),118 m²,"€1,650 per month","Description U HEEFT EEN OBJECTCODE NODIG ALS U ONS BELT. DE CODE IS: 7 9 3 9 0 Bezichtiging
Wij plannen alleen een bezichtiging wanneer u een Qii account heeft aangemaakt en uw gegevens via DigiD aan ons, ter inzage, heeft vrijgegeven. LET OP: minimaal inkomen van 79.200,-!                                                "
https://www.pararius.com/apartment-for-rent/deventer/ce0690ff/larenstein,"€1,350 per month",7413 XZ (Burgemeestersbuurt),85 m²,"€1,350 per month",Description Lovely apartment with balcony for rent in Deventer in the Burgemeestersbuurt district.
https://www.pararius.com/apartment-for-rent/amsterdam/44fe9479/nicolaas-maesstraat,"€6,100 per month",1071 PS (Museumkwartier),154 m²,"€6,100 per month","Description A bright, contemporary and fully furnished two-story upper house of approx. 154 sqm with a spacious roof terrace. This gorgeous family home was built in 1906 and entirely renovated in 2018/2019, resulting in an energy rating A. Layout
You enter the apartment on the second floor, which immediately leads to the 4 spacious bedrooms and the bathroom. The bedrooms contain a master bedroom, children’s bedroom, a baby’s room and a home office that also serves as a relaxing area. The bathroom is equipped with a walk-in shower, double sink and a bath tub. The second staircase takes you to the next floor, that allows you to step into the huge open-plan living with a modern kitchen containing all desired appliances such as a dishwasher, induction cooking with extractor, and a wine fridge. Open the doors to the balcony from the kitchen to start off your morning with some breakfast. Enjoy a good book at the fire place in the living room. The last staircase leads you to the roof terrace of approximately 35 m2.    "
https://www.pararius.com/apartment-for-rent/nijmegen/3c596ec0/berg-en-dalseweg,€995 per month,6522 BC (Hunnerberg),41 m²,€995 per month,"Description Unique Short-Stay Lofts at Canisiushof, Berg en Dalseweg About This Residence Welcome to your new home at Canisiushof, where each of the 120 unique lofts offers a distinct living experience. Located on the ground floor, this particular loft impresses with its high ceilings and an additional loft area overlooking the living room—perfect for those who appreciate character and charm.                         "
https://www.pararius.com/apartment-for-rent/amsterdam/202bb16d/pieter-baststraat,"€3,500 per month",1071 TW (Museumkwartier),115 m²,"€3,500 per month","Description TWO-FLOOR APARTMENT | RECENTLY RENOVATED | TRIPLE A LOCATION | ROOF TERRACE | 2-3 BEDROOMS Great 2 or 3-bedroom apartment in classy ‘Museum-district’ in the city. Located in a quiet street but in middle of all Amsterdam has to offer. Very bright and modern. It’s furnished and well kept. Layout:
Own entrance leads to 3rd floor. You enter into hall with stairs. Small hall with separate toilet and access to living. Wooden floor throughout the apartment. Living situated at front and has cute little French balcony facing South where in summer you can enjoy morning coffee. Kitchen is modern, fully equipped and catches light all day. Located at back of house. Also a balcony here facing West.   "
https://www.pararius.com/apartment-for-rent/groningen/cff9085b/fongersplaats,"€1,550 per month",9725 LC (Rivierenbuurt),90 m²,"€1,550 per month","Description For Rent: Stylish Furnished Apartment at Fongersplaats! Are you looking for a move-in-ready, stylishly furnished apartment in a prime location in Groningen? This beautifully furnished apartment in the well-maintained Fongerstede complex offers everything you need! Located on the second floor, you’ll enjoy a spacious layout with an open kitchen, two bedrooms, a northwest-facing balcony, and a private parking space in the covered parking garage. Energy label C ensures that your living costs remain favorable.                  "
https://www.pararius.com/apartment-for-rent/utrecht/da77c6b2/adenauerlaan,€920 per month,3527 RA (Kanaleneiland-Noord),50 m²,€920 per month,"Description !!ONLY RESPOND THROUGH THE AD, THROUGH THE MAIL AND BY PHONE REQUESTS WILL NOT BE CONSIDERED!!! Beautifully renovated flat near Utrecht city centre! Rental price: €920,00 excluding G/W/E, internet/tv and municipal charges State: Furnished             "
https://www.pararius.com/apartment-for-rent/rotterdam/c42c3db1/dordtselaan,"€1,375 per month",3073 GE (Bloemhof),58 m²,"€1,375 per month","Description Studio with extra room available in a lively neighbourhood in Rotterdam. Available per 1st of November. Bathroom, kitchen and toilet for own use in the hallway. Rent = 1375 euro's per month. EXCL. utilities and internet
Deposit = 2x the monthly rent
Registration possible and mandatory
Viewings possible this week already Rent = 1375 euro's per month. EXCL. utilities and internet Deposit = 2x the monthly rent Registration possible and mandatory Viewings possible this week already   "
https://www.pararius.com/apartment-for-rent/utrecht/33abf206/weerdsingel-w-z,"€2,050 per month",3513 BA (Pijlsweerd-Zuid),70 m²,"€2,050 per month",Description Beautiful apartment for rent in Utrecht with 1 bedroom in the Pijlsweerd-Zuid district.
https://www.pararius.com/house-for-rent/barneveld/6aec0229/valkappel,"€1,195 per month",3772 HR (De Burgt),123 m²,"€1,195 per month",Description Conveniently located house with garden for rent in Barneveld with 3 bedrooms in the De Burgt district.
https://www.pararius.com/house-for-rent/harderwijk/8707ed73/stakenbergerhout,"€1,275 per month",3845 JE (Harderhout II),114 m²,"€1,275 per month",Description Charming house with garden for rent in Harderwijk with 3 bedrooms in the Harderhout II district.
https://www.pararius.com/apartment-for-rent/deventer/357b9c90/p-c-hooftlaan,€711 per month,7412 PN (Schrijversbuurt),47 m²,€711 per month,Description Nice apartment for rent in Deventer in the Schrijversbuurt district.
https://www.pararius.com/apartment-for-rent/amsterdam/a4754761/rustenburgerstraat,"€2,275 per month",1072 HK (Nieuwe Pijp),60 m²,"€2,275 per month","Description Nice located apartment of about 60 m² with roof terrace. You enter the apartment through the stairwell. The hall gives access to the living room, kitchen, bedroom and bathroom. The open kitchen is equipped with various appliances such as a refrigerator, dishwasher and stove. The bathroom has a shower and sink. The toilet is separate.       "
https://www.pararius.com/house-for-rent/laren-nh/ab2bfbc8/sint-janstraat,"€5,750 per month",1251 KZ (Oostereng),170 m²,"€5,750 per month",Description Characteristic house with garden for rent in Laren with 3 bedrooms in the Oostereng district.
https://www.pararius.com/apartment-for-rent/groningen/1a08a1a2/bloemsingel,"€1,695 per month",9714 DS (Professorenbuurt),106 m²,"€1,695 per month","Description A beautiful, spacious 4-room apartment (106m2) located in the high-quality Bloemhof apartment complex, winner of the 'BNA Building of the Year' award in 2011. A great location in the Ebbingekwartier, a car-free zone and the Beren shopping center around the corner. The city center, the UMCG, the Noorderplantsoen and public transport are also within walking distance. A beautiful, green (shared) courtyard is part of this complex.               "
https://www.pararius.com/apartment-for-rent/delft/142b1a6d/arthur-van-schendelplein,"€1,495 per month",2624 CP (Voorhof-Hoogbouw),94 m²,"€1,495 per month","Description Spacious 4-room apartment on the eight floor with balcony and private storage room in the basement, located in the Voorhof district. The house is centrally located in relation to the shopping center 'In de Hoven' and public transport. There is a good connection with the various roads. In addition, the city center is 5 minutes by bike and Delft station is also within walking distance. There is a particularly spacious playground and a community center next to the car park. Rent is € 1.495,- per month excluding € 207,- in heating costs and other service costs, excluding G/W/E/TV and internet. Available: in negotiation November 1st, 2024.                           "
https://www.pararius.com/apartment-for-rent/maastricht/8c38a217/franciscus-romanusweg,€926 per month,6221 AG (Sint Maartenspoort),47 m²,€926 per month,"Description Nice apartment situated on the ground floor. The apartment has a living room with laminate floor, separate spacious kitchen (including equipment), large bedroom with laminate floor and a bathroom with shower, sink and toilet. There is also a large garden shared with one other apartment."
https://www.pararius.com/apartment-for-rent/rotterdam/524a1b12/wouwerlaan,"€2,250 per month",3043 HH (Overschie),117 m²,"€2,250 per month","Description This beautifully renovated 117 m² furnished home offers all you’re looking for across two spacious floors in the charming Overschie neighborhood of Rotterdam. The second floor features a large living room with views over the water, a stylish dining area, a semi-open kitchen, a hallway and a separate toilet. The south-facing balcony, perfect for relaxing, completes the space. Upstairs on the third floor, you’ll find two generously sized bedrooms, one of which comes with two walk-in closets. This floor has an additional storage room, and a dedicated laundry room with both a washing machine and dryer. The brand-new, modern bathroom offers luxury with a bathtub and separate shower.                 "
https://www.pararius.com/apartment-for-rent/amsterdam/dfebeed2/libau-eiland,"€2,500 per month",1014 ZK (Houthavens),79 m²,"€2,500 per month","Description Libau Eiland is one of the seven islands that make up Amsterdam's newest district: Houthaven. A master plan was created for the development of this new district, in which each island was given its own theme. Libau Island is the sixth built-up island on Houthaven and is named after a sturdy port (Liepãja) in Latvia and has the theme ‘Carpenters’. Wood dominates here. With somewhat lower buildings than on the other islands, with wooden facades, sloping roofs and many shades of grey and brown, Libau Island unmistakably refers to the original Houthaven. The natural materials and colors give a feeling of warmth, peace and familiarity.                    "
https://www.pararius.com/apartment-for-rent/amsterdam/73cdc401/keizersgracht,"€2,350 per month",1016 DX (Grachtengordel-West),80 m²,"€2,350 per month","Description Stylish apartment available on the Keizersgracht with a beautiful canal view and recently installed new kitchen. Details:
• Size of the property: 80 m2
• Number of bedrooms: 1
• Number of bathrooms: 1
• Type of house: Apartment with monumental status
• Construction year of the house: before 1905
• Interior decoration: Furnished
• Flooring: Parquet, carpet
• Quality of public transportation: Good                 "
https://www.pararius.com/apartment-for-rent/amsterdam/80cd503f/boeninlaan,€957 per month,1102 TP (Venserpolder),66 m²,€957 per month,"Description !!ONLY RESPOND THROUGH THE AD, THROUGH THE MAIL AND BY PHONE REQUESTS WILL NOT BE CONSIDERED!!! Fine flat in Amsterdam! Rental price: €957,26 excl. G/W/L, internet TV and municipal taxes
State: Furnished
Available per: 15-11-2024
Rental period: indefinite (minimum 12 months)                "
https://www.pararius.com/apartment-for-rent/rotterdam/d67bb5f3/kruiskade,"€1,406 per month",3012 EG (Cool),81 m²,"€1,406 per month","Description Spacious bare 2 room apartment at the 9nd floor on the Kruiskade in Rotterdam Centrum. Close to restaurants, shops and public transport. Note: The income requirements are 3 times the rent. -The rent must be paid quarterly. -The rent is excluding g/w/e TV + Internet. -Pets are not allowed. Layout: The apartment is reached through a closed entrance. From the entrance you enter the central hall with stairs and elevator to the apartments above. The apartment is approximately 81m2, a spacious living room with lots of light, has 1 bedroom, 1 balcony, a bathroom with separate toilet, kitchen with sufficient storage space. Dogs are not allowed. The building is located in the popular Cool district, a neighborhood where shopping, art, culture and dynamism are pre-eminently applicable. The location provides maximum convenience because all city activities such as the Lijnbaan, Schouwburgplein and theater De Doelen are in the immediate vicinity. From the apartment you can easily get everywhere on foot, by bike or public transport. Rotterdam Central is a 5-minute walk from the City House and you can easily reach the nearby roads to The Hague, Utrecht and Breda. Parking; paid parking with residents permit and several city garages in the area."
https://www.pararius.com/apartment-for-rent/enschede/cf651bde/oosterstraat,€795 per month,7514 DZ (De Laares),20 m²,€795 per month,"Description Beautiful studio available in Enschede! Dear reader, As of December 1st, we will have a beautiful studio available on the Oosterstraat in Enschede. The studio contains a living/bedroom, a luxury kitchen and a bathroom. The luxury kitchen is equipped with a hob, extractor hood, sink and a fridge-freezer. The luxury bathroom is equipped with a shower, washbasin with washbasin furniture and mirror. It also has an extra storage space.       "
https://www.pararius.com/apartment-for-rent/rotterdam/804c2dcc/schieweg,"€1,750 per month",3038 BL (Bergpolder),90 m²,"€1,750 per month","Description IF YOU ARE INTERESTED IN THIS PROPERTY, PLEASE RESPOND VIA EMAIL. LANDLORD HAS PREFERENCE FOR EXPATS. Situated in a very central location, surprisingly spacious and well-maintained 4/5 room double upstairs apartment located on the 3rd and 4th (also TOP) floor. The house has 2 balconies. The house has a fully equipped kitchen and lovely bathroom! The house is very centrally located in relation to arterial roads, public transport and the center of Rotterdam! Started ground:
Stairs to private entrance.                                      "
